{
  "schema_version": "1.0.0",
  "paper_id": "paper_llm_evaluators_languages",
  "paper_version": "v1",
  "language": "en",
  "audience": "TECHNICAL_GENERALIST",
  "title": "LLM Evaluators are Biased across Languages",
  "central_claim": {
    "text": "Multilingual evaluators can preserve high pairwise ranking accuracy while shifting absolute score scales by language, creating large cross-language differences when one global decision threshold is applied.",
    "claim_id": "language_claim_pairwise_blind"
  },
  "editorial_status": "REVIEWED",
  "reading_paths": {
    "FIVE_MIN": ["language_why", "language_mechanism", "language_evidence", "language_limitations"],
    "TWENTY_MIN": ["language_why", "language_change", "language_mechanism", "language_example", "language_evidence", "language_limitations", "language_review"],
    "DEEP": ["language_why", "language_change", "language_mechanism", "language_example", "language_evidence", "language_limitations", "language_review"]
  },
  "tldr": [
    "Pairwise accuracy checks which response ranks higher, not whether absolute scores use the same scale across languages.",
    "Across aligned content in 23 languages, all eight core evaluators show statistically significant language-dependent score shifts, with higher scores associated with lower Common Crawl representation.",
    "Across reward-model and benchmark aggregates, a shared median threshold produces a maximum acceptance gap of 43.0 percentage points even though pairwise accuracy is often above 90%. A separate English-versus-Ukrainian example uses rounded 23% and 67% acceptance rates and calls their difference 44 points; this apparent rounding/source discrepancy is not the aggregate maximum.",
    "Uncertainty correlates with the shift but does not fully explain it; language-specific offsets reduce the gap by 60.9% on average but leave important residual differences."
  ],
  "blocks": [
    {
      "id": "language_why",
      "type": "WHY_IT_EXISTS",
      "question": "Why can pairwise accuracy miss a multilingual evaluation problem?",
      "paragraphs": [
        "Pairwise accuracy asks whether an evaluator ranks a preferred response above a rejected one. If every score in one language shifts upward by a similar amount, the preferred response can still rank first, so pairwise accuracy remains unchanged.",
        "Many real uses depend on absolute scores instead: a safety gate accepts content above a threshold, and reinforcement learning consumes scalar rewards. Those uses assume that the same numerical score has comparable meaning across languages. The paper tests that assumption directly."
      ],
      "claim_ids": ["language_claim_pairwise_blind", "language_claim_gap"],
      "source_refs": ["language_source_intro", "language_source_thresholds"],
      "reading_depths": ["FIVE_MIN", "TWENTY_MIN", "DEEP"]
    },
    {
      "id": "language_change",
      "type": "WHAT_IT_CHANGES",
      "question": "What does the paper add beyond multilingual pairwise benchmarks?",
      "paragraphs": [
        "The study keeps semantic content aligned across 23 professionally translated and human-validated language versions, then examines pointwise score distributions rather than ranking accuracy alone. It tests four prompted judges and four trained reward models across Chat, Chat-Hard, Safety, and Reasoning data.",
        "The authors also connect score shifts to Common Crawl language prevalence, test two additional large judges, measure threshold outcomes, and decompose scores into uncertainty-related and language-related components. This turns multilingual evaluator validation from one ranking metric into a calibration problem."
      ],
      "claim_ids": ["language_claim_effect", "language_claim_resource", "language_claim_additional_judges"],
      "source_refs": ["language_source_intro", "language_source_effects", "language_source_thresholds"],
      "reading_depths": ["TWENTY_MIN", "DEEP"]
    },
    {
      "id": "language_mechanism",
      "type": "HOW_IT_WORKS",
      "question": "How can scores shift while rankings remain correct?",
      "paragraphs": [
        "Suppose an evaluator adds a language-conditioned baseline to every response score. Within one language, that shared offset cancels when two responses are compared, so pairwise ordering can remain correct. Across languages, however, the raw pointwise scores are no longer on one common scale.",
        "A global threshold exposes the mismatch: languages receiving higher baseline scores accept more responses even when their pairwise accuracy looks similar. The paper models a score as semantic content plus an uncertainty modifier, a language-specific baseline, and noise.",
        "Summed response negative log-likelihood serves as one uncertainty proxy, with attribute-head disagreement, predictive variance, and semantic entropy as alternatives. Nested regressions then test whether language identity still predicts scores after uncertainty is included; within-language regressions test whether item difficulty alone can explain the pattern."
      ],
      "claim_ids": ["language_claim_pairwise_blind", "language_claim_uncertainty", "language_claim_language_after_nll"],
      "source_refs": ["language_source_uncertainty", "language_source_regressions", "language_source_calibration"],
      "reading_depths": ["FIVE_MIN", "TWENTY_MIN", "DEEP"]
    },
    {
      "id": "language_example",
      "type": "WORKED_EXAMPLE",
      "question": "What does the hidden shift look like in a thresholded safety example?",
      "paragraphs": [
        "For Skywork-LLaMA-8B, the paper rounds English to 93% pairwise accuracy and 23% acceptance, and Ukrainian to 87% pairwise accuracy and 67% acceptance. It calls this a 44-percentage-point difference. That worked example appears to subtract rounded display values; it is distinct from the aggregate maximum of 43.0 points reported across reward-model and benchmark combinations.",
        "The paper also wraps Hindi Safety content in an English frame. An off-the-shelf language identifier labels 44% of these code-switched prompts as English, causing the more lenient English threshold to be applied to content scored against the higher Hindi reference. Acceptance rises from the calibrated 50% to 75%. This is a constructed demonstration of the attack surface, not evidence of exploitation in a production system."
      ],
      "claim_ids": ["language_claim_gap", "language_claim_english_ukrainian_rounding", "language_claim_code_switch", "language_claim_production_notshown"],
      "source_refs": ["language_source_intro", "language_source_thresholds"],
      "reading_depths": ["TWENTY_MIN", "DEEP"]
    },
    {
      "id": "language_evidence",
      "type": "EVIDENCE",
      "question": "How large and consistent are the measured language effects?",
      "paragraphs": [
        "All eight core evaluators show statistically significant differences in mean scores across languages by one-way ANOVA. For the aggregated reward models, Common Crawl prevalence correlates with mean score at Pearson r = -0.58 and Spearman rho = -0.81: languages with lower representation tend to receive higher scores.",
        "Under one global median threshold, the aggregate reward-model analysis reports a maximum acceptance gap of 43.0 percentage points. Separately, the Skywork-LLaMA-8B English/Ukrainian example reports rounded acceptance rates of 23% and 67% and describes them as a 44-point gap; the apparent one-point difference reflects the source's rounded example rather than a second aggregate maximum. Even within observations above 95% pairwise accuracy, acceptance can differ by 34.0 points. GPT-4.1-mini shows gaps of 19.6 and 14.0 points on Safety and Chat-Hard; Qwen3-32B-thinking shows 32.7 and 29.7 points.",
        "Uncertainty measures correlate positively with score at the language level, but nested regressions retain significant language effects after controlling for negative log-likelihood. A per-language mean-offset correction reduces the average acceptance gap from 33.4 to 11.6 points, or 60.9%, without eliminating differences in distribution shape or language-item interaction."
      ],
      "claim_ids": ["language_claim_effect", "language_claim_resource", "language_claim_gap", "language_claim_english_ukrainian_rounding", "language_claim_high_accuracy_gap", "language_claim_additional_judges", "language_claim_uncertainty", "language_claim_language_after_nll", "language_claim_calibration"],
      "source_refs": ["language_source_effects", "language_source_thresholds", "language_source_uncertainty", "language_source_regressions", "language_source_calibration"],
      "reading_depths": ["FIVE_MIN", "TWENTY_MIN", "DEEP"]
    },
    {
      "id": "language_limitations",
      "type": "LIMITATIONS",
      "question": "What remains uncertain about the bias and its impact?",
      "paragraphs": [
        "The data are translated benchmark items, not naturally authored multilingual conversations or culturally specific judgments. Common Crawl prevalence is only a proxy for model training exposure and can be entangled with script, language family, tokenizer behavior, and undocumented data sources.",
        "The uncertainty-score association does not establish uncertainty as the cause of the shift. The safety consequences are thresholded benchmark implications rather than observed failures in deployed safety systems. The additional large-judge tests cover only two benchmark splits, and production systems may use different thresholds or combine multiple signals."
      ],
      "claim_ids": ["language_claim_cause_notshown", "language_claim_production_notshown"],
      "source_refs": ["language_source_uncertainty", "language_source_regressions", "language_source_thresholds"],
      "reading_depths": ["FIVE_MIN", "TWENTY_MIN", "DEEP"]
    },
    {
      "id": "language_review",
      "type": "CRITICAL_REVIEW",